[
  {
    "method": "POST",
    "openapiPath": "/auth/csrf-token",
    "mswPath": "/api/auth/csrf-token",
    "handlerTag": "user:csrfToken",
    "owner": "auth",
    "status": "mock-handled",
    "critical": true,
    "schemaStatus": "schema-unavailable",
    "tests": [
      "ruoyi-fastapi-frontend/src/mocks/handlers/api-contract-schema.test.ts",
      "ruoyi-fastapi-frontend/src/mocks/handlers/api-contract.test.ts"
    ],
    "persistence": "readonly",
    "reason": "OpenAPI response schema is empty, unreliable, or outside the P0 runtime schema gate."
  },
  {
    "method": "POST",
    "openapiPath": "/auth/logout",
    "mswPath": "/api/auth/logout",
    "handlerTag": "user:authLogout",
    "owner": "auth",
    "status": "mock-handled",
    "critical": true,
    "schemaStatus": "schema-unavailable",
    "tests": [
      "ruoyi-fastapi-frontend/src/mocks/handlers/api-contract-schema.test.ts",
      "ruoyi-fastapi-frontend/src/mocks/handlers/auth-system.test.ts",
      "ruoyi-fastapi-frontend/src/mocks/handlers/api-contract.test.ts"
    ],
    "persistence": "dexie",
    "reason": "OpenAPI response schema is empty, unreliable, or outside the P0 runtime schema gate."
  },
  {
    "method": "POST",
    "openapiPath": "/auth/refresh",
    "mswPath": "/api/auth/refresh",
    "handlerTag": "user:refresh",
    "owner": "auth",
    "status": "mock-handled",
    "critical": true,
    "schemaStatus": "schema-unavailable",
    "tests": [
      "ruoyi-fastapi-frontend/src/mocks/handlers/api-contract-schema.test.ts",
      "ruoyi-fastapi-frontend/src/mocks/handlers/api-contract.test.ts"
    ],
    "persistence": "dexie",
    "reason": "OpenAPI response schema is empty, unreliable, or outside the P0 runtime schema gate."
  },
  {
    "method": "POST",
    "openapiPath": "/auth/ws-ticket",
    "mswPath": "/api/auth/ws-ticket",
    "handlerTag": "user:wsTicket",
    "owner": "auth",
    "status": "mock-handled",
    "critical": true,
    "schemaStatus": "schema-unavailable",
    "tests": [
      "ruoyi-fastapi-frontend/src/mocks/handlers/api-contract-schema.test.ts",
      "ruoyi-fastapi-frontend/src/mocks/handlers/auth-system.test.ts",
      "ruoyi-fastapi-frontend/src/mocks/handlers/api-contract.test.ts"
    ],
    "persistence": "readonly",
    "reason": "OpenAPI response schema is empty, unreliable, or outside the P0 runtime schema gate."
  },
  {
    "method": "GET",
    "openapiPath": "/captchaImage",
    "mswPath": "/api/captchaImage",
    "handlerTag": "user:captcha",
    "owner": "auth",
    "status": "mock-handled",
    "critical": true,
    "schemaStatus": "schema-unavailable",
    "tests": [
      "ruoyi-fastapi-frontend/src/mocks/handlers/api-contract-schema.test.ts",
      "ruoyi-fastapi-frontend/src/mocks/handlers/auth-system.test.ts",
      "ruoyi-fastapi-frontend/src/mocks/handlers/api-contract.test.ts"
    ],
    "persistence": "readonly",
    "reason": "OpenAPI response schema is empty, unreliable, or outside the P0 runtime schema gate."
  },
  {
    "method": "GET",
    "openapiPath": "/getInfo",
    "mswPath": "/api/getInfo",
    "handlerTag": "user:getInfo",
    "owner": "auth",
    "status": "mock-handled",
    "critical": true,
    "schemaStatus": "openapi-validated",
    "tests": [
      "ruoyi-fastapi-frontend/src/mocks/handlers/api-contract-schema.test.ts",
      "ruoyi-fastapi-frontend/src/mocks/handlers/auth-system.test.ts",
      "ruoyi-fastapi-frontend/src/mocks/handlers/api-contract.test.ts"
    ],
    "persistence": "dexie"
  },
  {
    "method": "POST",
    "openapiPath": "/login",
    "mswPath": "/api/login",
    "handlerTag": "user:login",
    "owner": "auth",
    "status": "mock-handled",
    "critical": true,
    "schemaStatus": "openapi-validated",
    "tests": [
      "ruoyi-fastapi-frontend/src/mocks/handlers/api-contract-schema.test.ts",
      "ruoyi-fastapi-frontend/src/mocks/handlers/auth-system.test.ts",
      "ruoyi-fastapi-frontend/src/mocks/handlers/api-contract.test.ts"
    ],
    "persistence": "dexie"
  },
  {
    "method": "POST",
    "openapiPath": "/register",
    "owner": "auth",
    "status": "missing",
    "critical": false,
    "schemaStatus": "not-applicable",
    "tests": [],
    "persistence": "none",
    "reason": "No explicit MSW handler metadata exists in the current contract registry baseline.",
    "impact": "Non-critical API remains backend-only or will receive deterministic 501 if called in strict demo-offline fallback.",
    "migrationTarget": "Classify as mock-handled, unsupported-501, real-only, or legacy-local-contract when the module joins demo-offline scope."
  }
]
